{
  "ensemble_scope_label": "REDUCED_PER_ADR_0013",
  "feature_time_label": "FEATURE_TIME=TUESDAY_DECISION",
  "games": [
    {
      "away_team": "UAB",
      "away_team_id": 5,
      "conference_game": false,
      "conviction_basis": {
        "favored_side": "home",
        "hysteresis_applied": false,
        "mu_margin": 20.41045003802525,
        "mu_sigma_ratio": 1.0162128101418726,
        "p_favored": 0.8859566418226321,
        "p_win_home": 0.8859566418226321,
        "previous_tier": null,
        "raw_tier": "strong_lean",
        "sigma_margin": 20.08481868593623
      },
      "conviction_label": "Strong lean Illinois",
      "conviction_team": "Illinois",
      "conviction_tier": "strong_lean",
      "ensemble_scope_label": "REDUCED_PER_ADR_0013",
      "feature_time_label": "FEATURE_TIME=TUESDAY_DECISION",
      "game_id": "401858424",
      "home_team": "Illinois",
      "home_team_id": 356,
      "is_stale": false,
      "kickoff_utc": "2026-09-04T01:00:00Z",
      "margin_interval_hi": 48.334411583062504,
      "margin_interval_lo": -6.977124525114682,
      "margin_interval_nominal": 0.8,
      "mu_margin": 20.41045003802525,
      "mu_total": 53.88415912713043,
      "neutral_site": false,
      "null_reason": null,
      "p_win_home": 0.8859566418226321,
      "p_win_home_credible": true,
      "published_at": "2026-08-18T22:01:05Z",
      "refresh_kind": "tuesday_primary",
      "season": 2026,
      "sigma_margin": 20.08481868593623,
      "sigma_margin_credible": true,
      "sigma_total": 16.386720018179503,
      "sigma_total_credible": true,
      "stale_sources": [],
      "stale_stamp": null,
      "tier_primary": null,
      "tier_revised_since_primary": false,
      "total_interval_hi": null,
      "total_interval_lo": null,
      "total_interval_nominal": null,
      "vintage_label": "W9A_REVAL",
      "week": 1
    },
    {
      "away_team": "San Jos\u00e9 State",
      "away_team_id": 23,
      "conference_game": false,
      "conviction_basis": {
        "favored_side": "home",
        "hysteresis_applied": false,
        "mu_margin": 10.352318009106801,
        "mu_sigma_ratio": 0.49446324652396845,
        "p_favored": 0.756465714197526,
        "p_win_home": 0.756465714197526,
        "previous_tier": null,
        "raw_tier": "clear_lean",
        "sigma_margin": 20.936476233335142
      },
      "conviction_label": "Clear lean Eastern Michigan",
      "conviction_team": "Eastern Michigan",
      "conviction_tier": "clear_lean",
      "ensemble_scope_label": "REDUCED_PER_ADR_0013",
      "feature_time_label": "FEATURE_TIME=TUESDAY_DECISION",
      "game_id": "401864495",
      "home_team": "Eastern Michigan",
      "home_team_id": 2199,
      "is_stale": false,
      "kickoff_utc": "2026-09-04T22:30:00Z",
      "margin_interval_hi": 36.77456275322187,
      "margin_interval_lo": -15.52427372129639,
      "margin_interval_nominal": 0.8,
      "mu_margin": 10.352318009106801,
      "mu_total": 53.18774057192598,
      "neutral_site": false,
      "null_reason": null,
      "p_win_home": 0.756465714197526,
      "p_win_home_credible": true,
      "published_at": "2026-08-18T22:01:05Z",
      "refresh_kind": "tuesday_primary",
      "season": 2026,
      "sigma_margin": 20.936476233335142,
      "sigma_margin_credible": true,
      "sigma_total": 20.704903666642284,
      "sigma_total_credible": true,
      "stale_sources": [],
      "stale_stamp": null,
      "tier_primary": null,
      "tier_revised_since_primary": false,
      "total_interval_hi": null,
      "total_interval_lo": null,
      "total_interval_nominal": null,
      "vintage_label": "W9A_REVAL",
      "week": 1
    },
    {
      "away_team": "UCLA",
      "away_team_id": 26,
      "conference_game": false,
      "conviction_basis": {
        "favored_side": "home",
        "hysteresis_applied": false,
        "mu_margin": 6.950383537616907,
        "mu_sigma_ratio": 0.36416186343929013,
        "p_favored": 0.7258165156796081,
        "p_win_home": 0.7258165156796081,
        "previous_tier": null,
        "raw_tier": "clear_lean",
        "sigma_margin": 19.085973121882418
      },
      "conviction_label": "Clear lean California",
      "conviction_team": "California",
      "conviction_tier": "clear_lean",
      "ensemble_scope_label": "REDUCED_PER_ADR_0013",
      "feature_time_label": "FEATURE_TIME=TUESDAY_DECISION",
      "game_id": "401858210",
      "home_team": "California",
      "home_team_id": 25,
      "is_stale": false,
      "kickoff_utc": "2026-09-06T02:30:00Z",
      "margin_interval_hi": 34.339516093883034,
      "margin_interval_lo": -23.618642508663434,
      "margin_interval_nominal": 0.8,
      "mu_margin": 6.950383537616907,
      "mu_total": 56.468027993050015,
      "neutral_site": false,
      "null_reason": null,
      "p_win_home": 0.7258165156796081,
      "p_win_home_credible": true,
      "published_at": "2026-08-18T22:01:05Z",
      "refresh_kind": "tuesday_primary",
      "season": 2026,
      "sigma_margin": 19.085973121882418,
      "sigma_margin_credible": true,
      "sigma_total": 17.809487299090996,
      "sigma_total_credible": true,
      "stale_sources": [],
      "stale_stamp": null,
      "tier_primary": null,
      "tier_revised_since_primary": false,
      "total_interval_hi": null,
      "total_interval_lo": null,
      "total_interval_nominal": null,
      "vintage_label": "W9A_REVAL",
      "week": 1
    },
    {
      "away_team": "Colorado",
      "away_team_id": 38,
      "conference_game": false,
      "conviction_basis": {
        "favored_side": "home",
        "hysteresis_applied": false,
        "mu_margin": 17.493694484620935,
        "mu_sigma_ratio": 0.8412037337165922,
        "p_favored": 0.8496477876735649,
        "p_win_home": 0.8496477876735649,
        "previous_tier": null,
        "raw_tier": "clear_lean",
        "sigma_margin": 20.79602572296082
      },
      "conviction_label": "Clear lean Georgia Tech",
      "conviction_team": "Georgia Tech",
      "conviction_tier": "clear_lean",
      "ensemble_scope_label": "REDUCED_PER_ADR_0013",
      "feature_time_label": "FEATURE_TIME=TUESDAY_DECISION",
      "game_id": "401856776",
      "home_team": "Georgia Tech",
      "home_team_id": 59,
      "is_stale": false,
      "kickoff_utc": "2026-09-04T00:00:00Z",
      "margin_interval_hi": 45.039620577656436,
      "margin_interval_lo": -13.306889791787974,
      "margin_interval_nominal": 0.8,
      "mu_margin": 17.493694484620935,
      "mu_total": 56.10168942374864,
      "neutral_site": false,
      "null_reason": null,
      "p_win_home": 0.8496477876735649,
      "p_win_home_credible": true,
      "published_at": "2026-08-18T22:01:05Z",
      "refresh_kind": "tuesday_primary",
      "season": 2026,
      "sigma_margin": 20.79602572296082,
      "sigma_margin_credible": true,
      "sigma_total": 17.62166907790666,
      "sigma_total_credible": true,
      "stale_sources": [],
      "stale_stamp": null,
      "tier_primary": null,
      "tier_revised_since_primary": false,
      "total_interval_hi": null,
      "total_interval_lo": null,
      "total_interval_nominal": null,
      "vintage_label": "W9A_REVAL",
      "week": 1
    },
    {
      "away_team": "Boise State",
      "away_team_id": 68,
      "conference_game": false,
      "conviction_basis": {
        "favored_side": "home",
        "hysteresis_applied": false,
        "mu_margin": 16.530562456395106,
        "mu_sigma_ratio": 0.9046963291291887,
        "p_favored": 0.8677395323938217,
        "p_win_home": 0.8677395323938217,
        "previous_tier": null,
        "raw_tier": "strong_lean",
        "sigma_margin": 18.271945982478478
      },
      "conviction_label": "Strong lean Oregon",
      "conviction_team": "Oregon",
      "conviction_tier": "strong_lean",
      "ensemble_scope_label": "REDUCED_PER_ADR_0013",
      "feature_time_label": "FEATURE_TIME=TUESDAY_DECISION",
      "game_id": "401858433",
      "home_team": "Oregon",
      "home_team_id": 2483,
      "is_stale": false,
      "kickoff_utc": "2026-09-05T19:30:00Z",
      "margin_interval_hi": 42.55518102384872,
      "margin_interval_lo": -12.27179926677093,
      "margin_interval_nominal": 0.8,
      "mu_margin": 16.530562456395106,
      "mu_total": 50.65073836526065,
      "neutral_site": false,
      "null_reason": null,
      "p_win_home": 0.8677395323938217,
      "p_win_home_credible": true,
      "published_at": "2026-08-18T22:01:05Z",
      "refresh_kind": "tuesday_primary",
      "season": 2026,
      "sigma_margin": 18.271945982478478,
      "sigma_margin_credible": true,
      "sigma_total": 16.28353044035645,
      "sigma_total_credible": true,
      "stale_sources": [],
      "stale_stamp": null,
      "tier_primary": null,
      "tier_revised_since_primary": false,
      "total_interval_hi": null,
      "total_interval_lo": null,
      "total_interval_nominal": null,
      "vintage_label": "W9A_REVAL",
      "week": 1
    },
    {
      "away_team": "Idaho",
      "away_team_id": 70,
      "conference_game": false,
      "conviction_basis": {
        "favored_side": "home",
        "hysteresis_applied": false,
        "mu_margin": 47.573613350745255,
        "mu_sigma_ratio": 2.2480270327979457,
        "p_favored": 0.9925946846908049,
        "p_win_home": 0.9925946846908049,
        "previous_tier": null,
        "raw_tier": "strong_lean",
        "sigma_margin": 21.162384907593417
      },
      "conviction_label": "Strong lean Utah",
      "conviction_team": "Utah",
      "conviction_tier": "strong_lean",
      "ensemble_scope_label": "REDUCED_PER_ADR_0013",
      "feature_time_label": "FEATURE_TIME=TUESDAY_DECISION",
      "game_id": "401856768",
      "home_team": "Utah",
      "home_team_id": 254,
      "is_stale": false,
      "kickoff_utc": "2026-09-04T01:00:00Z",
      "margin_interval_hi": 54.52072321097458,
      "margin_interval_lo": 1.5527312331718583,